{
  "schema": "aicad_production_readiness_contract_v3",
  "project": {
    "id": "SIFC-220-REV-A",
    "title": "High-stiffness servo indexer flange cartridge"
  },
  "requestedStage": "manufacturing",
  "discipline": "mechanical",
  "strictProductionOnly": true,
  "evidence": {
    "intent": {
      "wholeIntent": {
        "evidenceRef": {
          "kind": "authority_document",
          "path": "post_generation_evidence/review-only-evidence.json",
          "sha256": "7449c3c0f942c48bc56d61198fe6124bf41d3a9b7caafb5c6f3079e62fa5ba09"
        },
        "notes": "Review intent is recorded; manufacturing authority is not claimed."
      }
    },
    "design": {
      "constraintCompile": {
        "evidenceRef": {
          "kind": "machine_report",
          "path": "post_generation_evidence/review-only-evidence.json",
          "sha256": "7449c3c0f942c48bc56d61198fe6124bf41d3a9b7caafb5c6f3079e62fa5ba09"
        },
        "notes": "2D and 3D constrained plans compiled successfully."
      }
    },
    "manufacturingDefinition": {
      "materialDesignation": {
        "evidenceRef": {
          "kind": "machine_report",
          "path": "post_generation_evidence/review-only-evidence.json",
          "sha256": "7449c3c0f942c48bc56d61198fe6124bf41d3a9b7caafb5c6f3079e62fa5ba09"
        },
        "notes": "7075-T651 is declared, without full process authority."
      }
    },
    "verification": {
      "drawingCompleteness": {
        "evidenceRef": {
          "kind": "machine_report",
          "path": "post_generation_evidence/review-only-evidence.json",
          "sha256": "7449c3c0f942c48bc56d61198fe6124bf41d3a9b7caafb5c6f3079e62fa5ba09"
        },
        "notes": "Deliberately false until full manufacturing definition and licensed review exist."
      }
    },
    "host": {
      "nativeCadSaveReopen": {
        "evidenceRef": {
          "kind": "native_host_report",
          "path": "post_generation_evidence/review-only-evidence.json",
          "sha256": "7449c3c0f942c48bc56d61198fe6124bf41d3a9b7caafb5c6f3079e62fa5ba09"
        },
        "notes": "SolidWorks native save/reopen is hash-bound; other host gates remain absent."
      }
    },
    "release": {
      "manufacturingReviewRecorded": {
        "evidenceRef": {
          "kind": "review_release",
          "path": "post_generation_evidence/review-only-evidence.json",
          "sha256": "7449c3c0f942c48bc56d61198fe6124bf41d3a9b7caafb5c6f3079e62fa5ba09"
        },
        "notes": "Deliberately false; no manufacturing approval or signature is asserted."
      }
    }
  },
  "artifactSubjects": [
    {
      "partId": "SIFC-220-REV-A",
      "subjectType": "manufactured_part",
      "revision": "A"
    }
  ],
  "expectedArtifactClosure": [
    {
      "artifactId": "sifc-220-native-cad",
      "partId": "SIFC-220-REV-A",
      "kind": "native_cad",
      "path": "model3d_native_r2/SIFC_220_REV_A.SLDPRT",
      "revision": "A"
    },
    {
      "artifactId": "sifc-220-neutral-step",
      "partId": "SIFC-220-REV-A",
      "kind": "neutral_step",
      "path": "model3d_native_r2/SIFC_220_REV_A.step",
      "revision": "A"
    },
    {
      "artifactId": "sifc-220-controlled-drawing",
      "partId": "SIFC-220-REV-A",
      "kind": "manufacturing_drawing",
      "path": "drawing2d_final/SIFC_220_REV_A_DRAWING.dxf",
      "revision": "A"
    }
  ],
  "candidateArtifacts": [
    {
      "artifactId": "sifc-220-native-cad",
      "partId": "SIFC-220-REV-A",
      "kind": "native_cad",
      "path": "model3d_native_r2/SIFC_220_REV_A.SLDPRT",
      "revision": "A",
      "sha256": "bd94dbc6bf58783d403e080a0e96cc481263f92a9f9d53c92c33b5b415664535"
    },
    {
      "artifactId": "sifc-220-neutral-step",
      "partId": "SIFC-220-REV-A",
      "kind": "neutral_step",
      "path": "model3d_native_r2/SIFC_220_REV_A.step",
      "revision": "A",
      "sha256": "93c677a4be8bdba0d986a37aba3ed96e5bb8d14274998ad5435cdab82dd78f8a"
    },
    {
      "artifactId": "sifc-220-controlled-drawing",
      "partId": "SIFC-220-REV-A",
      "kind": "manufacturing_drawing",
      "path": "drawing2d_final/SIFC_220_REV_A_DRAWING.dxf",
      "revision": "A",
      "sha256": "8a8c8f877c51830debf93c00f4c6d98c9e7d7216bfa65e928406577507cbcc55"
    }
  ],
  "safetyLocks": {
    "reviewOnly": true,
    "accepted": false,
    "ruleEnabled": false,
    "packagingGated": true,
    "comparativeSuperiorityClaimAllowed": false
  }
}
